{
  "checkpoint": {
    "artifact_paths": [],
    "completed_work_units": [
      "investigate"
    ],
    "decisions": [],
    "dispatch_id": "DSP-5c73a6a14adb6ad23757",
    "next_permitted_action": "finalize",
    "phase": "explore",
    "schema_version": 3,
    "unresolved_issues": []
  },
  "checkpoint_sha256": "863ac2b27b55616a4ef261b5c9195b78b5990a1e4c6f5d586de57abf356bf668",
  "completed_work_units": [
    "investigate"
  ],
  "dispatch_id": "DSP-5c73a6a14adb6ad23757",
  "nonce": "NONCE-0827319f1394458477bf",
  "phase": "explore",
  "schema_version": 3,
  "updated_at": "2026-07-09T21:14:29.240745Z"
}
