{
  "checkpoint": {
    "artifact_paths": [],
    "completed_work_units": [
      "archive"
    ],
    "decisions": [],
    "dispatch_id": "DSP-f3a46592e5aecd545cca",
    "next_permitted_action": "finalize",
    "phase": "archive",
    "schema_version": 3,
    "unresolved_issues": []
  },
  "checkpoint_sha256": "029b81ef15c5e894a8ec1b33695649245634725d7024be501111490d3f6d59a0",
  "completed_work_units": [
    "archive"
  ],
  "dispatch_id": "DSP-f3a46592e5aecd545cca",
  "nonce": "NONCE-9cae7b5004c23e19fe48",
  "phase": "archive",
  "schema_version": 3,
  "updated_at": "2026-07-09T20:59:05.134605Z"
}
